{
  "schemaVersion": 1,
  "generatedAt": "2026-07-24T18:16:57.635Z",
  "upstream": {
    "repo": "https://github.com/SillyTavern/SillyTavern.git",
    "ref": "release",
    "commit": "8172dcd0ee672d3cd9a5e5f7af134f91a45cd2b8",
    "version": "1.18.0"
  },
  "output": {
    "webRoot": "sillytavern-web",
    "apiContract": "api-contract.json"
  },
  "hashes": {
    "webRootSha256": "02e1a7ee9fb600c1a336204c4a21843235d198b34cf08f5a223d383ca3b8fa8a",
    "patchQueueSha256": "b4291b6522601519367d5046c0f9663e04e70b7486baf6a64fb10bf74473bd0f"
  },
  "noRuntimeNode": true
}
